{
  "profile_version": "1.0.0",
  "mcp_tools_allowed": [
    {
      "server_hash": "a1b2c3d4e5f6a1b2c3d4e5f6a1b2c3d4e5f6a1b2c3d4e5f6a1b2c3d4e5f6a1b2",
      "tool_name": "read_file",
      "version": ">=1.0.0 <2.0.0",
      "data_classification_max": "internal",
      "description": "Read files from the allowed directory"
    }
  ],
  "egress_policy": {
    "default": "deny",
    "allow": []
  },
  "data_classification_default": "restricted",
  "io_validation": {
    "max_input_bytes": 1048576,
    "max_output_bytes": 10485760
  },
  "exfiltration_guards": {
    "max_egress_bytes_per_hour": 10485760,
    "max_egress_bytes_per_day": 104857600,
    "max_unique_domains_per_hour": 10,
    "max_tool_calls_per_minute": 60,
    "response_action": "suspend"
  }
}
