{
  "profile_version": "1.0.0",
  "mcp_tools_allowed": [
    {
      "server_hash": "a1b2c3d4e5f6a1b2c3d4e5f6a1b2c3d4e5f6a1b2c3d4e5f6a1b2c3d4e5f6a1b2",
      "tool_name": "read_file",
      "version": ">=0.1.0",
      "data_classification_max": "internal",
      "description": "Read files — development use"
    },
    {
      "server_hash": "a1b2c3d4e5f6a1b2c3d4e5f6a1b2c3d4e5f6a1b2c3d4e5f6a1b2c3d4e5f6a1b2",
      "tool_name": "write_file",
      "version": ">=0.1.0",
      "data_classification_max": "internal",
      "description": "Write files — development use"
    },
    {
      "server_hash": "a1b2c3d4e5f6a1b2c3d4e5f6a1b2c3d4e5f6a1b2c3d4e5f6a1b2c3d4e5f6a1b2",
      "tool_name": "list_directory",
      "version": ">=0.1.0",
      "data_classification_max": "internal",
      "description": "List directory contents — development use"
    },
    {
      "server_hash": "b2c3d4e5f6a1b2c3d4e5f6a1b2c3d4e5f6a1b2c3d4e5f6a1b2c3d4e5f6a1b2c3",
      "tool_name": "query",
      "version": ">=0.1.0",
      "data_classification_max": "internal",
      "description": "SQL queries — development database only"
    },
    {
      "server_hash": "c3d4e5f6a1b2c3d4e5f6a1b2c3d4e5f6a1b2c3d4e5f6a1b2c3d4e5f6a1b2c3d4",
      "tool_name": "get_issues",
      "version": ">=0.1.0",
      "data_classification_max": "public",
      "description": "GitHub issues — public repos only in dev"
    },
    {
      "server_hash": "c3d4e5f6a1b2c3d4e5f6a1b2c3d4e5f6a1b2c3d4e5f6a1b2c3d4e5f6a1b2c3d4",
      "tool_name": "create_issue",
      "version": ">=0.1.0",
      "data_classification_max": "public",
      "description": "Create GitHub issues — dev testing"
    }
  ],
  "egress_policy": {
    "default": "deny",
    "allow": [
      {
        "host": "localhost",
        "ports": [5432, 3000, 8080],
        "protocol": "tcp",
        "justification": "Local development services"
      },
      {
        "host": "api.github.com",
        "ports": [443],
        "protocol": "tcp",
        "justification": "GitHub API for development"
      },
      {
        "host": "*.npmjs.org",
        "ports": [443],
        "protocol": "tcp",
        "justification": "NPM registry for package resolution"
      }
    ]
  },
  "data_classification_default": "restricted",
  "io_validation": {
    "max_input_bytes": 10485760,
    "max_output_bytes": 52428800,
    "max_batch_bytes": 524288000,
    "max_nesting_depth": 32,
    "injection_detection": {
      "prompt_injection": true,
      "command_injection": true,
      "serialization_attacks": true
    }
  },
  "exfiltration_guards": {
    "max_egress_bytes_per_hour": 104857600,
    "max_egress_bytes_per_day": 1073741824,
    "max_unique_domains_per_hour": 25,
    "max_tool_calls_per_minute": 120,
    "response_action": "log",
    "pattern_detection": [
      "encoding_escalation",
      "chunked_exfiltration"
    ]
  },
  "audit": {
    "retention_days": 90,
    "retention_days_sensitive": 365,
    "anchor_to_ledger": false
  }
}
